{
  "schema": "claude-legal-audit.counterfactual-capture-patterns.v1",
  "revision": "1.1.0",
  "status": "candidate",
  "evidence_binding_contract": {
    "source_ids_mean": "Catalog-level context only; a listed source does not directly support every generated stage, signal, inference, control, or limitation edge.",
    "child_edge_source_inheritance": false,
    "direct_support_requires": "A dedicated source edge with binding_type and the source registry's exact locator.",
    "generated_relations_are": "Candidate model relations derived from the authored registry, not observed provider behavior."
  },
  "use_policy": {
    "mode": "defensive_synthetic_only",
    "capture_mode": "conceptual",
    "collection_enabled": false,
    "network_access": false,
    "identity_linkage": false,
    "cross_customer_linkage": false,
    "training_use": "prohibited",
    "secondary_use": "prohibited",
    "forbidden_actions": [
      "covert_collection",
      "deceptive_elicitation",
      "privilege_circumvention",
      "cross_tenant_probing",
      "nonconsensual_personnel_monitoring",
      "regulatory_evasion",
      "real_client_data_processing"
    ]
  },
  "patterns": [
    {
      "pattern_id": "CF-001",
      "name": "Transparent onboarding and practice interview",
      "alias": "Odysseus declared-policy surface",
      "objective": "Model how disclosed onboarding can reveal matter taxonomies, roles, authority, risk posture, and declared standard, fallback, and prohibited positions.",
      "stage_ids": ["LF-01", "LF-02", "LF-04", "LF-05", "LF-06", "LF-20", "LF-23"],
      "signal_classes": ["declared_workflow", "role_taxonomy", "risk_policy", "fallback_policy"],
      "derived_asset_planes": ["PLANE-OPERATIONS", "PLANE-JUDGMENT", "PLANE-GOVERNANCE"],
      "client_content_required": "no",
      "epistemic_status": "counterfactual_hypothesis",
      "implementation_status": "analysis_only",
      "defensive_test_mode": "synthetic_fixture_only",
      "consent_and_authority": {
        "required": true,
        "basis": "Specific organizational authority and transparent disclosure of purpose, fields, retention, and downstream use.",
        "decline_path": "Equally prominent decline with no loss unrelated to the requested service.",
        "human_gate": "Firm data owner and legal or professional-responsibility review."
      },
      "privilege_and_confidentiality_risk": "Abstract policy can expose crown-jewel operating logic; examples can become representation-related or work product.",
      "what_it_can_infer": ["Declared workflow and governance structure", "Stated escalation and fallback rules", "Firm terminology and task taxonomy"],
      "what_it_cannot_prove": ["Actual behavior in live matters", "Provider retention or secondary use", "Correctness or universality of the declared policy"],
      "countercontrols": ["Use synthetic examples", "Store the profile firm-side", "Send only task-relevant fragments", "Contractually prohibit generalized derivation"],
      "applies_when": ["A firm voluntarily configures a tool using abstract policy with specific authority."],
      "does_not_apply_when": ["The interview is concealed, bundled, or requests real-matter strategy without specific authority."],
      "danger_if_misapplied": "A transparent configuration workflow can become deceptive knowledge extraction if purpose, reuse, and refusal consequences are obscured.",
      "source_ids": ["SRC-0002", "SRC-0033", "SRC-0034"]
    },
    {
      "pattern_id": "CF-002",
      "name": "Playbook, template, and policy import",
      "objective": "Represent how formal playbooks and templates expose normative rules, fallback ladders, escalation thresholds, drafting standards, and institutional vocabulary.",
      "stage_ids": ["LF-05", "LF-06", "LF-10", "LF-11", "LF-13", "LF-20"],
      "signal_classes": ["playbook_rule", "template_delta", "escalation_threshold", "quality_standard"],
      "derived_asset_planes": ["PLANE-OPERATIONS", "PLANE-JUDGMENT"],
      "client_content_required": "sometimes",
      "epistemic_status": "counterfactual_hypothesis",
      "implementation_status": "analysis_only",
      "defensive_test_mode": "synthetic_fixture_only",
      "consent_and_authority": {
        "required": true,
        "basis": "Named owner approval for each source, field, processing purpose, model boundary, and reuse rule.",
        "decline_path": "Local-only or no-import path must remain available.",
        "human_gate": "Knowledge-management owner plus matter authority when source material derives from matters."
      },
      "privilege_and_confidentiality_risk": "Playbooks may contain firm strategy, client-derived rules, work product, negotiation floors, or confidential examples.",
      "what_it_can_infer": ["Formal policy ontology", "Fallback and exception hierarchy", "Standard drafting and approval logic"],
      "what_it_cannot_prove": ["Whether formal rules match actual behavior", "Whether a rule is firm-authored or client-required", "Any provider's intent to generalize the material"],
      "countercontrols": ["Parse locally", "Use field-level allowlists", "Preserve source genealogy and reuse authority", "Prohibit raw-source retention outside the firm"],
      "applies_when": ["A named owner authorizes a bounded source and the system enforces its reuse limits."],
      "does_not_apply_when": ["Source provenance, client authority, privilege status, or downstream rights are unknown."],
      "danger_if_misapplied": "Treating all playbooks as firm-owned and reusable can leak client-derived content and erase the authority of the source matter.",
      "source_ids": ["SRC-0002", "SRC-0033", "SRC-0034"]
    },
    {
      "pattern_id": "CF-003",
      "name": "Prompt and output processing trace",
      "objective": "Map the defensive exposure created when user requests, supplied context, model outputs, and task labels are processed to provide an AI service.",
      "stage_ids": ["LF-02", "LF-08", "LF-09", "LF-10", "LF-11", "LF-12", "LF-13", "LF-14", "LF-15", "LF-20"],
      "signal_classes": ["prompt_content", "output_content", "task_label", "conversation_context"],
      "derived_asset_planes": ["PLANE-OPERATIONS", "PLANE-JUDGMENT", "PLANE-CLIENT"],
      "client_content_required": "sometimes",
      "epistemic_status": "reasoned_inference",
      "implementation_status": "analysis_only",
      "defensive_test_mode": "synthetic_fixture_only",
      "consent_and_authority": {
        "required": true,
        "basis": "Matter-specific tool authority and fact-specific review of processing, retention, access, and use.",
        "decline_path": "Approved non-AI or local-only path without hidden transcript submission.",
        "human_gate": "Responsible lawyer and client-specific authority where required."
      },
      "privilege_and_confidentiality_risk": "Real prompts and outputs frequently contain information relating to a representation, work product, privileged communications, or personal data.",
      "what_it_can_infer": ["Issue classes and desired work products", "Longitudinal corrections and workflow needs", "Context-choice patterns when semantic content is present"],
      "what_it_cannot_prove": ["Model training, retention, or cross-customer use", "Legal correctness", "Hostile or concealed provider intent"],
      "countercontrols": ["Default content logging off", "Matter-scoped local gateway", "Short verified retention", "No feedback reuse by default", "Deletion receipts"],
      "applies_when": ["The exact service and deployment necessarily process a disclosed bounded prompt to perform the requested task."],
      "does_not_apply_when": ["The analysis assumes every product tier, feature, feedback path, or provider has the same data handling."],
      "danger_if_misapplied": "Conflating inference-time processing with retention or training creates false accusations; normalizing transcript capture creates confidentiality risk.",
      "source_ids": ["SRC-0005", "SRC-0007", "SRC-0009", "SRC-0033", "SRC-0034"]
    },
    {
      "pattern_id": "CF-004",
      "name": "Token, latency, cost, and recurrence metadata",
      "objective": "Model how input, output, cache-read, cache-write, latency, cost, recurrence, and workflow identifiers can expose workload shape and dependency without document text.",
      "stage_ids": ["LF-01", "LF-02", "LF-06", "LF-07", "LF-08", "LF-09", "LF-11", "LF-13", "LF-16", "LF-17", "LF-22"],
      "signal_classes": ["input_tokens", "output_tokens", "cache_read_tokens", "cache_write_tokens", "latency", "cost", "recurrence"],
      "derived_asset_planes": ["PLANE-OPERATIONS", "PLANE-GOVERNANCE"],
      "client_content_required": "no",
      "epistemic_status": "reasoned_inference",
      "implementation_status": "analysis_only",
      "defensive_test_mode": "synthetic_fixture_only",
      "consent_and_authority": {
        "required": true,
        "basis": "Organization-approved observability purpose with data minimization, role separation, retention, and aggregation rules.",
        "decline_path": "Product analytics opt-out where operational security and billing do not require the field.",
        "human_gate": "Firm security, privacy, finance, and data-governance owners."
      },
      "privilege_and_confidentiality_risk": "Sparse metadata can become client- or matter-related when linked to identity, time, tool, stage, court, or outcome.",
      "what_it_can_infer": ["Workload size and cadence", "Stage bottlenecks", "Model and tool dependence", "Approximate workflow recurrence"],
      "what_it_cannot_prove": ["Substantive legal strategy", "Meaning or correctness of the work", "That metadata is used for model training or product discovery"],
      "countercontrols": ["Aggregate locally", "Remove stable identities", "Use minimum cohort thresholds", "Short purpose-limited retention", "Separate security and product analytics"],